组件名称,I V Clamping and compliance Control
模块名称,Low Noise Op Amps (<= 10nV/vHz)
Part #,Description,Product Lifecycle,Availability,Price (1000+) ($ US),Package,# of Amps,GBP (typ) (Hz),BW -3 dB (typ) (Hz),Slew Rate (typ) (V/µs),VNoise Density (typ) (V/rtHz),Current Noise Density (typ) (A/rtHz),Rail to Rail,Iq/Amp (typ) (A),Vs span (min) (V),Vs span (max) (V),Amp Features,Package Area (mm²),产品链接
ADA4077-2,"4 MHz, 7 nV/√Hz, Low Offset and Drift, High Precision Dual Amplifier",Recommended for New Designs,4993,¥16.79000 (ADA4077-2ARMZ),"8-Lead SOIC,8-Lead MSOP",2,3.9M,,1,7n,200f,,400µ,5,30,,16.48mm² (8-Lead MSOP) (ADA4077-2ARMZ),https://www.analog.com/zh/products/ada4077-2
ADA4084-2,"30 V, Low Noise, Rail-to-Rail Input/Output, Low Power Operational Dual Amplifier",Recommended for New Designs,5131,¥28.90000 (ADA4084-2ARMZ-R7),"8-Lead LFCSP (3mm x 3mm w/ EP),8-Lead SOIC,8-Lead MSOP",2,15.9M,13.9M,4.6,3.9n,550f,Both,565µ,3,30,,9mm² (8-Lead LFCSP (3mm x 3mm w/ EP)) (ADA4084-2ACPZ-R7),https://www.analog.com/zh/products/ada4084-2
ADA4805-2,"Dual, 0.2 µV/°C Offset Drift, 105 MHz Low Power, Low Noise, Rail-to-Rail Amplifier",Recommended for New Designs,1515,¥19.10000 (ADA4805-2ARMZ-R7),"10-Lead LFCSP (3mm x 3mm),8-Lead MSOP",2,30M,105M,190,5.2n,700f,"In to V-, Output",570µ,2.7,10,Rail-to-Rail Output,9mm² (10-Lead LFCSP (3mm x 3mm)) (ADA4805-2ACPZ-R2),https://www.analog.com/zh/products/ada4805-2
